title,company,salary,category,publicated,description
Middle/Senior Python Engineer,UPPeople,,"Категорія: Python,Англійська: Upper-Intermediate,3 роки досвіду","Вакансія опублікована 21 лютого 2023,27 переглядів,6 відгуків","We are looking for a Senior Python Engineer for the cutting-edge AI project to join our team.,What is this project about?,The project is from Ireland, whose mission is to build an amazing data science development experience. You can be part of the team who rethought the process of building real, practical AI solutions in a modern context.,It is a cloud-based software service that makes it simple to develop reliable, consistent custom computer vision solutions in minutes. Its cutting-edge security mechanisms ensure the piece of mind regarding data protection that might be essential for businesses. By design, the product produces results that are simple to understand and support the inferences made by their models.,It’s a completely new and revolutionary product in the Data Science field!,The team,You will join the professional team: 3 UI/UX designers, 2 Frontend Engineers, and a Project Manager.,Also, there is the engineers’ team on the client’s side: Head of Engineering, Lead Frontend Engineer, and 3 Backend Engineers.,Is there a legacy?,No!,Why was the position opened?,Due to the project’s growth.,The process:,How many stages of the interview are there?,— Interview with the Recruiter — up to 30 min.;,— CV prescreen by the customer;,— Tech interview on our side;,— Possible tech interview with the Head of Engineering on the customer side.,Requirements:,Hard skills:,— At least 4+ years of commercial experience with Python (Django/Flask);,— Experience with FastAPI;,— Experience in working with containerized Kubernetes applications or applications in a Service-oriented architecture;,— Experience with AWS;,— SQL and Postgres;,— Docker and Git;,— Lambdas, Pandas;,— At least an Upper-Intermediate level of English.,Nice to have:,— Knowledge of Data Engineering.,Responsibilities:,— Back-end development;,— Design and implementation of new features;,— Requirements analysis, task planning, estimation, coding;,— Suggesting technical and functional improvements for the project.,We offer,Work vibe,— Flexible working hours (full-time, 8 hours working day);,— No screenshots, bureaucracy; time logging for accounting only. We trust you!;,— Quality workstations. Mostly we choose a Macbook so you will receive comfortable equipment for work, or you can work on your own device;,— Dynamic environment with a low level of bureaucracy;,— Teambuildings, swag, corporate events, and the team you will actually want to hang out with.,Holidays and leaves,— 20 days of paid annual vacation;,— 15 days of paid sick leaves;,— Possibility to use vacation during probation;,— Days off on all Ukrainian government holidays.,Education,— Education program 100 — we provide $100 per year for education;,— Mentorship program (get a mentor or become one);,— English Lessons with a 6-month review process (speaking and writing classes);,— Refunding certification expenses;,— Corporate Udemy account, where any employee can request any course free of charge.,Perks:,— Social package, including medical insurance or sports compensation or psychological training sessions;,— IT Club Loyalty personal card in Lviv ІТ Cluster;,— Overtime is not welcome. Ralabs always emphasizes that we are working to provide work-life balance for employees;,— We work in a completely white field, and the salary is paid to the card in euros or dollars every first week of the month."
"Senior Full-Stack Engineer (Python/React ), in Ukraine or Poland",Intellias,,"Категорія: Python,Англійська: Upper-Intermediate,5 років досвіду","Вакансія опублікована 20 лютого 2023,7 переглядів,1 відгук","Our Swiss client is an independent, partner-owned investment firm founded in 2013, with a growing team of currently 70 people and offices in Switzerland. We are dedicated to a long-term, global investment strategy focused on public equity markets.,Our highly disciplined investment process combines fundamental research expertise and advanced data science. We aim to identify high-quality mid-cap stocks with 2X return potential over a time horizon of 5–7 years, equivalent to a 10–15% return per annum. What sets us apart from others is our collective decision-making, the level of insight and transparency we offer to our investors, and the use of technology to enhance all aspects of our business.,The technology department comprises 20 members – 6 Quant Researcher, 5 Data Engineers and 8 Fullstack Developers. We believe in collaboration and collective team intelligence while encouraging individual contributions.,🔸 Develop, test, and maintain our web application using Python and React.,🔸 Design and implement user interfaces using React.,🔸 Develop and maintain Python backend services.,🔸 Monitor the application and ensure problems are addressed and fixed.,🔸 Stay up-to-date with industry trends and advancements in web development and bring new ideas and solutions to the organization.,🔸 Participate in code reviews and provide constructive feedback to team members.,🔸 Provide technical guidance and mentorship to juniors.,🔸 This role requires a candidate who is passionate about data and finance, works well in a collaborative team-based environment, and is proactive and intrinsically motivated to go the extra mile.,🔸 A Bachelor's or Master's degree in Computer Science or related field.,🔸 Expert Knowledge in Python with experience in organizing large code bases. We rely on flask, sqlalchemy, celery heavily,🔸 Experience with Frontend Development using TypeScript and React,🔸 Proficient in data modelling and structuring relational databases. Proficient in SQL,🔸 Experience with modern data tools is a plus (like pandas, dask, pyspark),🔸 Experience with Infrastructure / DevOps is a plus (Docker, Cloud, Azure),🔸 Experience with data visualization is a plus (like D3.js),🔸 A good understanding of Finance is a plus (for example Financials, balance sheets, accounting data, FX),#22921"
Senior/Middle+ Python Software Engineer (Prom.ua),EVO,,"Категорія: Python,3 роки досвіду","Вакансія опублікована 20 лютого 2023,61 перегляд,7 відгуків","– найбільший маркетплейс України, де продаються понад 100 млн товарів від десятків тисяч підприємців з усієї країни.,На Prom.ua:,кожен покупець може знайти все, що потрібно, за найкращою ціною: від зубної щітки до культиватора для саду та городу.,кожен підприємець може продавати товари в каталозі маркетплейса, на сайті, створеному на платформі Prom та у мобільному додатку “Prom покупки”.,щодня маркетплейс відвідують 4,8 млн осіб,на маркетплейсі працюють понад 60 тис. компаній,у каталозі 102,5 млн товарів,Мови програмування: Python 3, JS, Go,Сервіси: PostgreSQL, Redis, Kafka, ElasticSearch, ClickHouse, MongoDB,Інфраструктура: Self-hosted Kubernetes, Openstack.,Портал prom.ua працює в Kubernetes як сукупність незалежних сервісів. Налагодженні системи логування (kibana), моніторингу (prometheus/grafana), CI/CD (gitlab).,Більша частина сервісів написана на Python 3.10 (синхронний та асинхронний),Інша частина на Go.,Міжсервісна комунікація налагоджена через gRPC, REST, Kafka.,У якості бази даних використовується PostgreSQL,Для зберігання великих об’ємів даних — ClickHouse. Також MongoDB в основному для файлів (gridfs).,Client side написано на JavaScript. З використанням ReactJS та інших відомих бібліотек.,4 Developers, Team Lead, 3 QA, Product Manager,Команда займається всім, що стосується просування продуктів на порталі:,Кабінет продавця, що дозволяє налаштовувати рекламні кампанії, встановлювати ставки на рекламу, дивитися аналітику відображення реклами та конверсії.,Ведення обліку списання грошей за конверсійні дії з рекламою: кліки, замовлення.,Ранжування. Аналіз якості рекламного оголошення: конверсії в кліки і в замовлення, рейтинги продавця, кількість відмін замовлень і інші показники “якості”.,Інтеграція зі сторонніми рекламними мережами для просування продуктів в мережах партнерів: google, rtbhouse, criteo.,Впевнене знання мови програмування Python. Та принципів побудови асинхронних програм.,Вміти будувати розподілені сервіси.,Розуміти як працюють WEB-застосунки,Буде плюсом вміння написання простих UI на будьякому JS фреймворку.,Буде плюсом знання Go.,робота над GraphQL API адмін-панелі сервісу генерації даних для рекламних мереж;,підтримка, розвиток та оптимізація модулів сервісу генерації даних для рекламних мереж;,Технічний борг в нашому проєкті один з пріоритетів на який завжди виділяється час.,Команда працює за гнучкою методологією, не боїмося підлаштовувати процеси під себе,У кожного розробника є глибоке розуміння всієї системи та інфраструктури, розробка це не тільки про код, але і про особисте зростання та культуру,Ми цінуємо work-life balance,Немає великої кількості мітингів,Знайомство (до 30 хв),Технічне інтерв’ю (тривалість 1,5 години). Обговоримо всі важливі питання по стеку, досвіду, завданням.,Фінальне інтерв’ю (тривалість 30 хвилин)"
Senior Python Developer,Geniusee,,"Категорія: Python,Англійська: Upper-Intermediate,5 років досвіду","Вакансія опублікована 21 лютого 2023,21 перегляд,5 відгуків","This is a project in FinTech domain. Neobank for the medical structure which is supposed to be an aggregator for payment services and insuarance companies. The application will be providing the ability to store contracts, accounting details of the healthcare facilities in one place.,What you will need:,● 3+ years of professional experience with Python web applications (preferably using Flask frameworks);,● Experience in Flask or FastAPI and extenensions (ORM, API),● Experience with Redis, Mongo, PostresSQL,● Experience with AWS infrastructure,● Experience with payment service integration will be bonus (Stripe, WorldPay or other),● Upper-Intermediate English level.,What will you get:,● Competitive salary and good compensation package;,● Exciting, challenging and stable startup projects with a modern stack;,● Corporate English course;,● Ability to practice English and communication skills through permanent interaction with clients from all over the world;,● Professional study compensation;,● Career development opportunity, semi-annual and annual salary review process;,● Necessary equipment to perform work tasks;,● VIP medical insurance or sports coverage;,● Informal and friendly atmosphere;,● The ability to focus on your work: a lack of bureaucracy and micromanagement;,● Flexible working hours (start your day between 8:00 and 11:30);,● Team buildings, corporate events;,● Paid vacation (18 working days) and sick leaves;,● Cozy offices in 2 cities ( Kyiv & Lviv ) with electricity and Wi-Fi ( Generator & Starlink ),● Unlimited work from home from anywhere in the world (remote);,● Geniusee has its own charity fund.,Reasons you will love working at Geniusee:,● Employee-friendly working conditions,One of Geniusee’s core values is treating each team member like a trusted partner. You get to choose your work environment because you know yourself best.,● Teamwork beats distance,We put effort into maintaining a happy, friendly atmosphere within the team. We see each other at team meetups, workshops, G-talks, marathons, and other events.,● Excellent tools and equipment,You don’t have to worry about your work gear, Geniusee will provide you with high-quality hardware appropriate for your job description.,Your Geniusee Career Growth:,● 360-degree feedback — a process through which feedback from an employee’s subordinates, colleagues, and supervisor, as well as a self-evaluation by the employee themselves, is gathered,● Evaluation — time to talk with an expert. Together, you will assess the progress you have achieved,● Navigation — summarize your review with a manager and define your future goals"
Python Developer  (DCOS),OSF Digital,,"Категорія: Python,Англійська: Intermediate,2 роки досвіду","Вакансія опублікована 21 лютого 2023,115 переглядів,21 відгук","• 2+ years of Python experience,• Good knowledge of Python and integrations, API use, etc;,• SQL knowledge is a must,• AI experience is considered a plus;,• Experience in Agile software development methodologies;,• Familiarity with web technologies;,• Proven strong teamwork, communication, collaboration, and ownership skills;,• Good English is a must,• Develop and maintain existing solutions,• Maintain, configure and improve integration with various enterprise software,• Clarify requirements and advice on the technical approach,• Responsible for coding quality and maintainability of development,• Write top-notch code that will enhance business value,• Communicate with cross-functional teams that will develop applications,• Managing priorities, deadlines, and deliverables,• Enforce best practices regarding project-specific procedures and coding standards,• International working environment,• Continuous learning programs,• Clearly defined career path,• Technical certifications,• Paid sick leaves,• Periodic evaluations with salary raises and bonuses in accordance with performance,• Flexible schedule and opportunity to work remotely"
Senior Python developer,Academy SMART,,"Категорія: Python,Англійська: Intermediate,5 років досвіду","Вакансія опублікована 21 лютого 2023,18 переглядів,2 відгуки","Academy SMART invites Python Developer to its team.,Role responsibilities:,● Improve quality of existing solutions and services,● Effectivelly understands project needs to be developed and suggests the best ways to execute the task,● Brainstorms the right technological solutions to complex problems,Skills and Qualifications:,● 5+ years of experience in development,● 3.5 of experience with Python,● Experience with React,● Experience and deep understanding of design patterns and microservices architecture,● AWS Cloud services knowledge/experience,● Experience with Django,● Experience with MYSQL, REDIS, Elastic,● Experience with containerization platforms and orchestration like: docker, Kubernetes, OpenShift,● Good English communication skills,We offer,● 20 working days of paid vacation per year;,● Official holidays of Ukraine – days off;,● Modern equipment for work;,● Corporate events;,● External and internal training: conferences, professional events, courses, TechTalks;,● English speaking club.,Project is https://www.comm-it.com/"
Game Mathematician (Python),Idenon,,"Категорія: Python,Англійська: Intermediate,3 роки досвіду","Вакансія опублікована 21 лютого 2023,7 переглядів,1 відгук","welcomes talented professionals to join our dynamic company as a Game Mathematician!,We are seeking a driven and motivated individual to join our team. You will be a key player in the delivery of our products and services, working with some of the brightest minds in the industry.,IDENON is a Ukrainian company that builds global tech businesses. IDENON ecosystem includes 3 projects that work in online gaming industry.,— 3+ years of experience on positions like Mathematician in gambling is must;,— Bachelors, Masters or Phd in Mathematics, Statistics;,— Understanding of applied mathematics: probability theory and statistics, numerical methods, linear algebra, optimization;,— Ability to describe processes in detail and clearly articulate their thoughts in writing;,— Analytical approach in the process of working on problems;,— Attention to detail, generation of ideas.,— Knowledge of algorithms and data structures, interpolation methods, regression models, theory of stochastic processes, cryptography;,— Proficient in Python.,— Writing rules for slots, showing the mechanics of the game, and documenting them in the Wiki;,— Creation of slots in accordance with the requirements of RTP, imposed by the rules (Main spins, Free games, Bonus games, features, etc.);,— Conducting a review of the rules of the slots checking the statistical data collected by bots when writing the server implementation of the game;,— Participation in general meeting that affect such things as the mechanics of slots;,— Active participation in game planning.,You will enjoy corporate benefits, like:,,— You will have the opportunity to choose where you want to work — at one of our comfortable offices or home. We ensure comprehensive company-paid 17 paid days off during the year; sick leaves and you can request an unpaid leave of absence.,,— Expert communities paid certifications and professional events.,,— Achieving your goals is much easier with a strong team by your side. It is made up of industry experts and technology enthusiasts who work together towards a common vision.,We value honesty, openness, friendliness, positive attitude, independence.,Let’s create a cool product with us:)"
Python Developer,Plex,,"Категорія: Python,Англійська: Upper-Intermediate,5 років досвіду","Вакансія опублікована 21 лютого 2023,38 переглядів,1 відгук","Requirements:,- 5+ years experience as a Data Engineer,- Experience 3+ years as a Backend developer,- Experience 3+ years in Python,- Experience with technologies such as Airflow/Kafka.,- Deep understanding FastAPI/Django/Flask.,- Deep understanding AWS,- Upper-Intermediate English level;,Will be a plus:,- Good knowledge with Spark,- Good knowledge with different SQL/ NoSQL database solutions,- Good knowledge working on relational databases (PostgreSQL, Microsoft SQL Server);,- Strong Computer Science fundamentals.,We offer:,- Paid training time and adaptation;,- 20 paid vacation days, 15 paid sick leave days, and days off on public holidays;,- Salary twice a month;,- Flexible working hours, remote;,- Individual English lessons;,- Friendly, positive, fun atmosphere;,- An individual approach and help from management at any stage of work;,- Full-time, long-term employment, and career growth opportunities;,- Opportunity to start your own “pet project”;"
Middle Python Developer( Europe),3DLook,,"Категорія: Python,Англійська: Upper-Intermediate,3 роки досвіду","Вакансія опублікована 21 лютого 2023,10 переглядів,3 відгуки","3DLOOK is a leading virtual fit company that enables innovative personalized shopping experiences based on a consumer’s unique body profiles to drive conversion and engagement and reduce returns. The has around 100 active clients around the globe, including some of the biggest brands in the world, has been recognized in Gartner® Hype Cycle™ for Retail Technologies 2021, won the Digiday Technology Award and RTIH Innovation Award in 2021, LVMH Innovation Award, and the IEEE Retail Digital Transformation Grand Challenge in 2019, and was recognized as one of the 2020 Pioneers of the New World.,We are looking for a Backend Software Developer. You will work with one of our main products - Tryon. The solutions we have developed include machine learning, machine vision models, Unreal Render, and a lot of custom-made algorithms. Your job will be to develop scalable and maintainable services and systems. Maintain and improve existing solutions.,Requirements:,- Previous commercial experience working as a hands-on engineer.,- Solid understanding of best practices and writing clean and scalable software;,- Experience with Linux as a server, understanding of Cloud infrastructure and experience with one of the leading providers AWS/GCP/Azure.,- 3+ years of experience with Python, Django/DRF;,- Experience with designing REST API. Understanding of fundamental design principles behind a scalable application;,- Experience with Jenkins;,- Experience with task queues, Celery (+ Redis, RabbitMQ);,- Experience with SQL databases (PostgreSQL);,- Able to create database schemas that represent and support business processes;,- Understanding of front-end technologies HTML/CSS, JS;,- Strong testing and debugging skills, experience with appropriate tools such as pytest.,- Proficient understanding of code versioning tools such as git;,Nice to have:,- Dockerization and virtualization. Understanding of orchestration.,- Experience with different types of data storage.,- Experience with GitHub actions.,- Experience with FastAPI.,Responsibilities:,- Support and add new features for existing projects.,- Creation of pipelines, automation, services etc.,- Development of REST/gRPC endpoints.,- Creation of scalable, maintainable services from existing scale solutions.,- Writing Python scripts for data processing, automation, testing and analysis.,- Writing tests.,What we offer:,- Career perspectives inside the company (growth up to Executive positions);,- Participation in the Stock Option Program is granted after 6 months of work in the company in case of exceptional results;,- Professional workshop attendance at the company’s expense. According to corporate policy, you may request compensation for participation in an educational course, webinar, etc. In such a case, the company can refund these expenses partly or fully;,- You will be entitled to 4 weeks (20 working days) of paid vacation in a year;,- Paid sick leaves (10days/year with full coverage);,- Flexible working hours;"
