title,company,salary,category,publicated,description
Middle Python Engineer,Palavero Inc.,$3000-4500,"Категорія: Python,Англійська: Upper-Intermediate,3 роки досвіду","Вакансія опублікована 16 лютого 2023,54 перегляди,12 відгуків","Teramind is a hybrid, global workforce building the next-generation Insider Risk Management and User Behavior Analytics platform.,Join our team of innovators who are redefining insider risk management through cutting edge technology. More than 10,000 organizations across the globe use Teramind to mitigate insider threats and protect their sensitive company data with the most robust, enterprise-grade software on the market.,As a global team, Teramind embraces an inclusive and flexible work environment and team culture. We win together, learn from each other and respect each other while delivering best-in-class security solutions.,About the Role,Teramind is seeking a Python Engineer with a proven track record for a full-time remote position.,You will work on the development and improvement of our analytical and reporting services.,Working hours align with your location’s normal business hours.,Requirements,- 3+ years experience with Python.,- Experience with: PostgreSQL (or any SQL database).,- Proficient knowledge of GIT.,- Experience with algorithms, data structures, complexity analysis, and software design.,- Understanding fundamental design principles behind scalable applications.,- Ability to learn and implement new knowledge.,- Technical English level: Intermediate and higher.,- Good communication skills.,Will be a plus,- Experience with flask, pydantic, sqlalchemy, fastapi.,- Experience with Data warehousing / analytics solutions (Snowflake, Redshift, Tableau, Druid, etc).,- Experience with ClickHouse DBMS.,Responsibilities include but are not limited to,- Design, develop, test, deploy, maintain and improve software with a strong focus on customer-facing features.,- Be the technical owner of features, from design to implementation to ongoing support.,Benefits,- This is a remote job. Work from anywhere!,We’re a global, distributed team looking for the finest talent. We’ve been thriving as a fully-remote team since 2014. To us, remote work means flexibility and having truly diverse, global teams.,- At Teramind, we’re a collaborative, forward-thinking team where new ideas come to life, experience is valued and talent is incubated.,- Competitive compensation: $3000 - $4500,- Career-growth opportunities.,- Flexible Time Off and Paid Time Off benefits.,- Ongoing training and development opportunities.,About our recruitment process,We don’t expect a perfect fit for every requirement we’ve outlined. If you can see yourself contributing to the team, we want to hear your story.,You can expect up to 4 interviews,- Intro-call (30 min),- Test task (2h),- Technical interview (1h),- Final interview (1h),All roles require background checks,Teramind is an equal opportunity/affirmative action employer. All qualified applicants will receive consideration without regard to race, age, religion, color, marital status, national origin, gender, gender identity or expression, sexual orientation, disability, or veteran status."
Python developer,Peppernode,,"Категорія: Python,Англійська: Intermediate,2 роки досвіду","Вакансія опублікована 16 лютого 2023,223 перегляди,57 відгуків","Ми знову шукаєм бекенд гуру на новий проект. Є досвід, фантазія, вміння писати бекенд логіку - тобі до нас в колектив :),Ми молода, що швидко розвивається компанія Peppernode. Шукаємо собі в команду сильного бекенд спеціаліста.,Що для нас важливо в першу чергу:,- Розуміння ВЕБ технологій, Http, Client-Server коммунікації,- Python3.8+,- Django/DRF, understanding microservices architecture,- English intermediate or higher,- Хороше розуміння та досвід Docker/Docker Compose,- Адміністрування Unix systems skills (AWS чи DO),- Впевнене володіння GIT, вміння читати та ревьювити код колег,- Робота з деплойментом, CI/CD, досвід Github actions чи чогось подібного.,- Досвід з FastAPI та Flask,Також важливо:,- Самостійна робота над проєктом (звісно будуть мітинги, брейншторми і т.д. з командою) але важливо вміти розв'язувати проблеми самостійно,- Постійна робота над своїми знаннями, ініціатива по покращенню проєктів.,- Почати своє повідомлення нам з рядка Mela, Peppernode!,Ми пропонуємо:,- Цікаві проєкти з використанням сучасних технологій,- Веселий молодий колектив,- Вчасну компенсацію на рівні ринку, можливість шкидкого росту,- Покриття курсів на покращення тех знань"
Full stack (Lead) developer,1WorldOnline R&D Center (Business Automatics),,"Категорія: Python,Англійська: Advanced/Fluent,5 років досвіду","Вакансія опублікована 16 лютого 2023,31 перегляд,0 відгуків","About Us,1World online R&D Center provides full cycle of technology consulting and research & development using various stacks, technologies and IoT elements. The company specializes in developing web and client-server applications, designing websites and IT consulting. We provide the whole complex of software,engineering services and unique IT solutions.,About Project,FRMG is building a DaaS/SaaS platform designed to take geospatial data (satellite, lidar, imagery, maps) to produce valuable and insightful data. Our primary product is focused on fire risk insurance which leverages digital terrain models, ground based fuel (trees and understory) in relation to assets (buildings, energy grids, pipelines, municipalities) on the ground.,The Full Stack Developer will produce scalable geospatial software solutions and will be Leading a cross-functional team that’s responsible for the full software development life cycle, from conception to deployment.,Qualifications & Skills:,• 5-7 years in web and backend development (Python, JavaScript, React JS, Django).,• 2+ years of experience working with multi-tenant cloud native applications.,• Knowledge/experience with GIS frameworks such as OpenLayers, QGIS, PostgreSQL, PostGIS, GeoServer, GDAL/OGR, MapServer, Leaflet, Esri Leaflet, serverless GIS.,• Experience working with cloud environments such as AWS EC2, EBS, S3, RDS, EKS and familiarity with containerization (Docker, Kubernetes, Lambda etc.).,• Experience writing integrations with third-party APIs and developing REST APIs.,• Contribute to all phases of the software development lifecycle in a team environment using project tracking tools such as GitHub or JIRA.,• Knowledge/experience of WMS, WFS, WCS, WMTS and WPS web services of the OGC.Strong knowledge Javascript (es5, es6).,• Experience in all phases of the software development lifecycle (analysis, design, development, testing, deployment, maintenance.,• Serve as technical lead on projects.,Will be a plus:,• Experience with Java.,• Knowledge/experience with commercial & open-source GIS software products considered a major plus.,Responsibilities:,• Leads application development of a desktop and web app DaaS/SaaS geospatial platform working with our geomatics team.,• Design separate components, modules, classes etc.,• Code, debug, document, and maintain portions of software.,• Participate in peer code and design reviews.,• Participate in estimation and planning sessions.,Contribute to development of technical project documentation and user documentation.,• Provide assistance to test engineers and support personnel in solving technical issues of software installation and its operation.,• Participate in conference calls and face-to-face meetings.,• Spot current deficiencies in the development process, adopted procedures and engineering practices, environment configurations, etc., and suggest improvements.,• Escalate technical issues to the other members and Project Manager.,We offer:,• Competitive compensation depending on skills and experience level,• Ability to learn new technological stacks, which help you to grow professionally and advance your career,• Interesting projects with attractive salary,• Friendly atmosphere,• Flexible schedule depends on project’s needs,• 15 working days of vacation,• 12 working days per year are allowed to be “no show days” due to personal reasons.,Location:,Ukraine only: remote"
Data Mining Engineer needed for data centric startup,Forecasa,,"Категорія: Python,Англійська: Upper-Intermediate,Без досвіду","Вакансія опублікована 15 лютого 2023,711 переглядів,102 відгуки","We're in the process of scaling our current systems and looking for a clever, flexible, and resourceful engineer to help build out our data pipelines.,Our existing pipelines scrape websites for data, clean and transform the data, then make the data available to our front end UI.,Our tech stack primarily uses Kubernetes, Docker, Airflow, PySpark, Pandas, Selenium, Postgres, S3, and gitlab for CI/CD.,You will be responsible for:,- Developing web scrapers for the Data Acquisition team and optimizing pipeline execution.,- Using pandas to normalize data.,- Creating docker images of scrapers to be deployed to kubernetes.,- Creating airflow dags to schedule pipelines.,- Developing tests to ensure proper pipeline execution.,This position requires experience developing python and writing web scrapers.,NOTE: Please make all e-mails and communications through the djinni website. Thank you."
Senior Python Developer,Luxoft,,"Категорія: Python,Англійська: Upper-Intermediate,5 років досвіду","Вакансія опублікована 15 лютого 2023,10 переглядів,0 відгуків","Project Description:,Applying to the position, you may join one of the most respected and fastest growing institutional investors in the world. Our client is a professional investment management organization that globally invests the funds to ensure long-term sustainability. The company invests in all major asset classes, including public equity, private equity, real estate, infrastructure and fixed-income instruments, and currently has offices in Toronto, London, Hong Kong, New York, São Paulo, Luxembourg and Mumbai.,Client attracts and selects high-caliber individuals from top-tier institutions around the globe. Join our team and look forward to:,• Diverse and inspiring colleagues and approachable leaders,• Stimulating work in a fast-paced, intellectually challenging environment,• Accelerated exposure and responsibility,• Global career development opportunities,• Being motivated every day by important social purpose and unshakable principles,• A deeply rooted culture of Integrity, Partnership and High Performance,If you share a passion for performance, value a collegial and collaborative culture, and approach everything with the highest integrity, here's an opportunity.,Responsibilities:,In this project, you will work on a Total Funds Management platform used for managing overlay risk across the pension's holdings,Manage timelines/deliverables within the team towards the successful delivery of projects. Design software solutions by interacting with portfolio managers, traders, operations staff and peers to understand requirements. Develop solutions that are in line with client's technology biases, deliver efficiency and scalability, and enable new trading activities. Provide knowledge transfer to team members and support staff through application demos, walkthroughs, and documentation. Provide end-user support to ensure minimal disruption to portfolio management and trading activities. Other duties as assigned.,Mandatory Skills Description:,• University degree in Engineering or Computer Science preferred.,• Excellent communication with experiences working with direct users to collect/discuss complex business requirements,• Excellent communication within the development team, ability to highlight risks, delays and proposing efficient solutions,• Experience working in Agile / Scrum teams, experience with Agile development practices,• Python FLASK, Pandas, 5+ years,• Good knowledge in SQL, ability to manipulate data and write complex data queries 2+ years. Experience with AWS Aurora (PostgreSQL) would be a plus,• CI/CD Jenkins, Urban Code 2+ years,Nice-to-Have Skills:,• Experience in Angular JS or similar framework 2+ years,• SQLAlchemy, Pylint, pynose, Gulp 2+ years,• Virtualenv, Anaconda pkgs / pypi 2+ years,• Knowledge in cloud-based and serverless (AWS) stack,• Linux, AWS ECS, AWS Lambda, ECS Fargate"
Middle Python Developer,Wetelo,,"Категорія: Python,Англійська: Intermediate,2 роки досвіду","Вакансія опублікована 15 лютого 2023,69 переглядів,15 відгуків","Wetelo specializes in custom tech solutions while heedfully focusing on our clients’ business objectives and needs. Our core competencies:,- work with SaaS products from planning to implementation;,- solutions for business automation;,- cross-platform applications.,Currently, we are looking for a Python developer to join our team.,So we would like you to have:,- 2+ years of machine learning and predictive analytics experience using Python;,- excellent interpersonal, written, and verbal communication skills;,- strong ability in problem solving and driving for results;,- experience with related AWS services and large datasets;,- strong personal interest in learning, researching, and creating new technologies with high customer impact;,- strong sense of self-motivation, organization, and attention to detail; strong analytical skills;,- experience with Scrum/Agile methodology, CI/CD;,- English: Upper-Intermediate level (both speaking and writing).,It is nice to have:,- familiarity with Git for project management and versioning;,- experience deploying data science engineering a plus: Kubernetes, Docker, etc.;,- familiarity with statistical modeling techniques such as hierarchical models, time series forecasting, and causal analysis.,And we can offer you:,- outstanding promotion opportunities;,- supportive and comfortable working environment;,- free grammar and vocabulary English on-site courses;,- variety of training and self-development opportunities;,- fancy team-building events and corporate parties;,- social security package and other perks."
Full Stack (Python + React) Developer,GetApp Group,,"Категорія: Python,Англійська: Upper-Intermediate,3 роки досвіду","Вакансія опублікована 15 лютого 2023,100 переглядів,34 відгуки","A few facts about us:,- Technical stack of our team: JS (React and Node), Java, Golang, Python and others,- Whereas our business model is outstaff, we offer a search for a project that matches not only the developer's stack but also matches his interests,- Our developers are involved in long-term projects in the fields of Fintech, Healthcare, Education, E-commerce, SaaS, etc. We do not consider projects in the Betting, Gambling, Adult content, and similar domains,- Each of our developers is involved only in one project (full-time),- Our current clients are from the USA and Europe,- This year we hope to grow up, regardless of the conditions, and organize the work of outsourcing teams,- Hostilities did not affect the stability of our company: not a single dismissed person, not a single reduction in the rate or other payments because of war, the terms of payment of salaries have not shifted. The founders are optimistic about the future, so our team continues to grow.,What we offer for your success,+ Competitive salary and regular performance reviews,+ The ability to focus on your work: a lack of bureaucracy and micromanagement,+ No unpaid overtimes,+ Timely salary payment,+ 50% compensation for English courses (if it’s needed),+ 19 paid days off,+ Adaptation period of 2 months,+ Attention) The salary amount depends on the results of the tech. interview and your experience,About your responsibilities:,No long descriptions are needed: every developer knows his tasks while on a project. The specific list of tasks will depend on the project, of course.,What you need for this position:,- At least 3 years of experience developing with Python (Django).,- At least 3 years of experience with JavaScript and CSS.,- Experience with React.,- Strong problem-solving capabilities.,- Excellent communication skills, written and verbal.,If you have any questions about this job post, please feel free to ask.,Contact us and become a valuable part of the People-First team"
Senior Python Developer,Kyrrex,,"Категорія: Python,Англійська: Intermediate,5 років досвіду","Вакансія опублікована 14 лютого 2023,51 перегляд,6 відгуків","Наші очікування від кандидата:,— Досвід роботи Python Developer в продуктових компаніях від 5-ти років,— Досвід роботи з блокчейном, на крипто-проєктах буде в пріорітеті,— Досвід роботи з API шлюзами (побудова, налаштування, багатозадачність та комплексні запити),— Знання PostgreSQL, MySQL databases,— Знання Automatic tests (pytest, unittest),— Знання REST,— Досвід менторства,— Англійска мова - Intermediate,Що потрібно робити:,— Побудова алгоритмів для високочастотної торгівлі та торгових сценаріїв,Коротко про умови:,— цікавий продукт, моживості для розвитку,— віддалена робота,— гнучкий графік,— відпустка - 24 календарних дні,— оплачуваний лікарняний"
Middle Python Developer,Kyrrex,,"Категорія: Python,Англійська: Intermediate,3 роки досвіду","Вакансія опублікована 14 лютого 2023,70 переглядів,15 відгуків","— Досвід роботи Python Developer в продуктових компаніях від 3-х років,— Досвід роботи з блокчейном, на крипто-проєктах буде в пріорітеті,— Досвід роботи з API шлюзами (побудова, налаштування, багатозадачність та комплексні запити),— Знання PostgreSQL,— Знання Automatic tests (pytest, unittest),— Англійска мова - Intermediate,— Побудова алгоритмів для високочастотної торгівлі та торгових сценаріїв,— цікавий продукт, моживості для розвитку,— віддалена робота,— гнучкий графік,— відпустка - 24 календарних дні,— оплачуваний лікарняний"
Middle/Senior Python Developer,Software Rocket,$3000-5000,"Категорія: Python,Англійська: Upper-Intermediate,3 роки досвіду","Вакансія опублікована 15 лютого 2023,120 переглядів,34 відгуки","• Degree or higher in Computer Engineering or similar,• 4+ years of experience in web development using Python/Django/Flask,(preferred) or .NET/C#,• Experienced in HTTP, HTTP2, JavaScript, CSS e REST,• Deep understanding relational databases,• Having the JavaScript and its frameworks (React and Angular) experience is,a plus.,• Experience in native mobile applications (Android and iOS) is valued,- completely remote work;,- a responsible team of senior level specialists driven by the delivering of quality results;,- many projects, which allows you to switch in between in the future to improve your skills;,- paid vacation - 20 working days;,- 10 days of sick leave (with a medical certificate)."
Python (Django) Developer,PLANEKS,,"Категорія: Python,Англійська: Intermediate,2 роки досвіду","Вакансія опублікована 14 лютого 2023,165 переглядів,15 відгуків","0. Fast and comfortable hiring process.,1. 100% remote(even before the COVID) work opportunity and flexitime - choose working hours between 8:00-20:00.,2. Manage your compensation $$$$ budget - Travel tickets, Work equipment, Health insurance, Software, Sport, Training.,3. Salary paid in USD + tax compensation. Revision every 6 months. We want everyone to be confident in what tomorrow brings.,4. Everything to provide a good rest. YES: Paid vacation, national holidays, sick leaves(and support in case of serious diseases). NO: overtime, work on weekends.,5. Regular feedback, mentorship, code review. Friendly and professional team that supports you. Well, we're proud of how we handle that. So you can always count on us.,6. Speaking clubs with a native speaker to constantly maintain your English level.,7. No bureaucracy - transparent processes and flat management. Working remotely means keeping things as simple as possible to work efficiently.,We propose something more significant than a job. PLANEKS means developing a new lifestyle for our colleagues and clients. So take your part in it!,1. Software development experience(at least 2 years) with:,— Python and Django,— Other Python frameworks (e.g., Flask),— PostgreSQL, MySQL and MongoDB,— Celery, Redis, ElasticSearch,— Cloud providers, DevOps, CI/CD,— Unit, integration, E2E tests,2. Knowledge of REST and experience working with REST APIs,3. Experience with JS, HTML, CSS (Usually 0-20% of activity),4. Communication skills in English (good writing and speaking),1. Develop, support, and maintain projects in Python - usually, we create products from scratch but also have existing projects where the dev team should be extended. And also, we do not work with legacy codebases.,2. Solve technical challenges - all our projects are different, and you’ll never be bored with the same tasks every day, so your acquisitive mind will have great challenges regularly.,3. Take care of quality (code, test, business features, documentation) - everyone enjoys working with clean, readable code, so it is important to keep it such.,4. Participate in code reviews - usually, it is cross-reviews in the team or reviews by a senior person.,5. Communicate with internal and external teams - we’re in touch with great minds - inventive clients, and supportive colleagues!,6. Improve your technical and soft skills - just a normal evolution :)"
Strong Junior to Middle Python Developer,GlobalLogic,,"Категорія: Python,Англійська: Upper-Intermediate,2 роки досвіду","Вакансія опублікована 15 лютого 2023,259 переглядів,38 відгуків","🔸Команда із 20 інженерів працює над розробкою продукту, який є доступною альтернативою традиційній системі відеозйомки. Це автоматизоване виробниче рішення на основі штучного інтелекту забезпечує на спортивному ринку прості та доступні способи виробництва та розповсюдження високоякісних ігор, відеороликів для гравців та аналізу продуктивності. Система складається з унікальної панорамної камери та стандартних комп'ютерів, що використовують власні алгоритми для панорамного та HD відео та управління камерою. На ринку проект вже більше 5 років.,🔸Графік роботи стандартний, так як клієнт з Ізраїлю. Спілкування з клієнтом англійською.,🔸 Щодо вимог: Python, REST, AWS,🔸 Етапи: технічне та клієнтське інтерв’ю."
