title,company,salary,category,publicated,description
Python developer,INFOTECH,,"Категорія: Python,2 роки досвіду","Вакансія опублікована 1 березня 2023,61 перегляд,22 відгуки","ДП «ІНФОТЕХ» шукає кваліфікованого спеціаліста на вакантну посаду «Python developer» для роботи в команді по вирішенню завдань діджиталізації органів державної влади.,• Програмування Python( Django, DRF),• Python3, Django, DRF,,• docker, postgresql, redis, celery, mongo,• HTML, JS, CSS, REACT, REDUX,• Розробка та супроводів програмного забезпечення створеного мовою,• Відмінна команда та доброзичлива обстановка;,• Офіційне працевлаштування та конкурентоспроможний рівень оплати праці;,• 28 днів оплачуваної відпустки;,• Матеріальна підтримка у разі приємних та неприємних життєвих подій;,• Можливість застосування гнучкого робочого графіку;,• Повне технічне забезпечення;,• Зручний та комфортний офіс поруч зі станцією метро «Лук’янівська»."
Senior Python Backend engineer,MoveUp Recruitment agency,,"Категорія: Python,Англійська: Upper-Intermediate,5 років досвіду","Вакансія опублікована 28 лютого 2023,9 переглядів,2 відгуки","We are a fast-moving company creating the next generation of web security technologies and delivering them to our expanding list of international clients.,We’re at the forefront of multiple trends, uniquely combining cloud computing, Big Data, Machine Learning, and other cutting-edge fields into an intelligent, dynamic, and robust cybersecurity SaaS platform running on the public cloud of customer choice.,We are growing quickly, and we’re looking for capable, creative, and self-motivated people to grow with us. If you’d like to advance your career while being at the intersection of multiple global trends (cloud adoption, SaaS, machine learning, cybersecurity, and more), we’d love to hear from you!,The Role,We are looking for an experienced Backend Engineer to join our R&D team. We are looking for an exceptionally talented backend developer experienced with modern cloud-native technologies to join our R&D team, building Reblaze web security multi-cloud products and services.,Primary Responsibilities:,- Drive innovation, build and improve the product,- Ensure the technical feasibility of cloud designs,- Optimize application for maximum speed and scalability,- Help to define technical requirements and architecture, and execute best-in-class implementation,Requirements:,- A team player that can thrive in a very dynamic environment,- Experience in backend development on cloud GCP/AWS/Azure,- Experience with writing design and architecture documents,- Proficient in Python - 5+,- Experience with K8S, Docker and Ingress gateways,- Experience with microservices,- Familiarity with Go (advantage),- Scrum Master Experience,- Experience with the K8S toolchain and ecosystem, such as Promoteus, Gafana and Argo,- Understanding of web applications security chall,- Fluent in English, verbal and written"
Python Developer for EdTech company,Projector,,"Категорія: Python,Англійська: Intermediate,3 роки досвіду","Вакансія опублікована 28 лютого 2023,27 переглядів,1 відгук","Шукаємо КУРАТОРА на курс із Python у Projector Institute.,Ми метчимо, якщо:,— в тебе комерційний досвід - 3-4 роки;,— бакалавр комп’ютерних наук або схожої спеціальності;,— досвід менторства junior/trainee колег;,— знання інших мов програмування;,— досвід роботи з вебом, БД і написанням тестів.,У кураторів є 3 основні задачі:,— перевірка та фідбек на домашні завдання студентів;,— проведення вебінарів 1/2 рази на тиждень, онлайн у вечірній час;,— комунікація зі студентами.,Шукаємо людину, яка хоче викладати, менторити новачків і доводити їх до результату:)"
Python Full Stack Developer,Nortal,,"Категорія: Python,Англійська: Upper-Intermediate,5 років досвіду","Вакансія опублікована 28 лютого 2023,22 перегляди,1 відгук","Nortal is on the hunt for a skilled Python Full Stack Developer for long-term and full-time employment! You will be working within a cross-functional team on a fully serverless project that have distributed event-driven architecture.,About our client,TUI UK is a subsidiary of TUI group, one of the world’s leading leisure travel groups, with over 220 trusted brands in 180 countries and more than 30 million customers. At TUI, they create unforgettable moments for customers across the world and make their dreams come true. With a great history of success, they recognize the power of digital and the massive contribution this brings to creating a truly unique and differentiated customer experience.,About the project,TUI is undergoing a crucial digital transformation. What does it mean for the development team? No legacy and only cutting-edge technologies. Not only the tech part of the project is fantastic, but also the internal culture. All team members are granted a high level of power over technical choices and empowerment over business decisions. So why not join this wonderful project? We have modern technologies, international tech experts on board, and indeed – a welcoming team!,Mission,As part of an empowered Scrum team, you have a joint responsibility to design, implement and deliver a certain domain of our new platform,Proactively work with your product owner to help shape the direction of the platform Advice on implementing,Front-end best practices (performance, security, maintainability, etc),Design the architecture for the new system together with architects within the group,Design, implement and maintain Cloud requirements for development,Requirements,3+ years’ experience with Python,Proficiency with data persistence (Elasticsearch/OpenSearch API/DSL),Proficiency AWS Lambdas, API Gateway, SNS, SQS, State Machines/Step functions,Experience with CI/CD, preferably Gitlab Terraform,Experience with implementing resource-oriented APIs (REST or GraphQL) on client and server side,Experience with any JavaScript framework,Knowledge of HTML5, CSS3/SCSS, as well as general understanding of UI design,Ability to design, build, test, and deploy applications,OOP,Upper-intermediate level of English,Good communication skills and a proactive / ”can do” attitude"
Python Developer (Middle),Helix Global LLC,,"Категорія: Python,Англійська: Intermediate,3 роки досвіду","Вакансія опублікована 28 лютого 2023,64 перегляди,14 відгуків","We are looking for an employee in a project that develops online games.,Let's create a cool product with us:),Your future responsibilities:,— Development of network applications;,— Development of automation tools.,The following skills are mandatory:,— Experience in a similar position at least 3+ years;,— Deep understanding of the multiprocessing, multithreading and asynchronous concepts,— Experience with Debian-based Linux distributions;,— Understanding of client-server architecture;,— Understanding of the principles of the HTTP protocol;,— Experience in developing unit-tests, including for asynchronous code;,— Experience with SQLAlchemy and MariaDB/MySQL (experience with MariaDB will be a plus),— Experience with Git.,The following skills are desirable:,— Experience in developing networked applications using asynchronous framework(-s) (AsynclO/Aiohttp/Tornado/Sanic, willing to train),— Experience in Tornado will be a plus,— Experience with RabbitMQ, Kafka, Nats, Redis, MariaDB/MySQL/PostgreSQL/CockroachDB,— Experience with Docker, Docker,— Experience with AWS/Azure;,— Experience with GitLab.,What we offer:,— Flexible schedule — You will have the opportunity to choose where you want to work — at one of our comfortable offices or home. We ensure comprehensive company-paid 17 paid days off during the year; unlimited sick leaves and you can request an unpaid leave of absence.,— Learning and professional growth — Expert communities paid certifications and professional events.,— Growth environment — Achieving your goals is much easier with a strong team by your side. It is made up of industry experts and technology enthusiasts who work together towards a common vision.,We value honesty, openness, friendliness, positive attitude, independence.,Let’s create a cool product with us:)"
Fullstack Python/React Developer,Elementica,$1500-3800,"Категорія: Python,Англійська: Intermediate,3 роки досвіду","Вакансія опублікована 28 лютого 2023,30 переглядів,2 відгуки","Build the most meaningful apps on the latest web technologies!,Welcome to Elementica! We are excited to see you on our profile. Elementica is a leading global software development company – expert in delivering web development, mobile application development and IT consulting services of any complexity to clients worldwide.,www.elementica.io,We are looking for a talented Fullstack Python/React Developer to join our Development Team. You will be at the core of our talented Web Apps teams and focus on building the most advanced and meaningful apps and workflows on the latest web technologies.,As a fullstack developer, you will work on our next generation applications, a specific project critical to our customer’s needs. We need our engineers to be versatile, display leadership qualities and be enthusiastic to take on new challenges as we continue to push technology forward.,We are Product oriented developers with a growth mindset. We are curious problem solvers and we like to collaborate, communicate, share knowledge and technical ideas and grow together.,- Develop cloud based frontend and backend web applications,- Work in all phases of the software development life-cycle (planning, design, implementation, deployment, monitoring and support),- Collaborate and grow in a dynamic environment while working in small, agile and cross functional teams,- Use the latest technologies to solve real problems for our customers,- Communicate and coordinate with our engineering team in Ukraine.,- Results-orientation, collaborative, pragmatic and agile mindset,- Strong knowledge in working with Javascript, Typescript and Python,- Expertise with the cloud (preferably AWS or GCP),- Working proficiency in English (written and verbal),- Continuous independent learning,* Strong knowledge of one or more Python frameworks (Django, Flask, FastAPI),* Familiarity with some ORM (Object Relational Mapper) libraries,* Strong knowledge of relational (PostgreSQL) and non-relational (MongoDB) databases,* Experience with React hooks, CSS-in-JS, Redux, Jest,* Understanding of SSR with Next.js,* Understanding of common development principles and best practices (SOLID, DRY, YAGNI) and basic understanding of design patterns,* Experience working with Docker and Docker Compose,* Experience in CI/CD processes is a plus,* Experience with web performance optimizations,* The opportunity to drive the development of cutting-edge software products,* The chance to work on interesting technical challenges such as advanced algorithms, wide integrations or scalable content management,* A positive, highly skilled, young team with a focus on quality,* Hybrid/remote working possibility / Home-office friendly / Flexible working hours,* Pick your own gear: Linux or IOS - whatever works best for you,* A lot of room for your own ideas. We always highly encourage you to work on them together with the team.,* Outstanding compensation based on experience and 20 days vacation,* Sponsored training opportunities with Udemy and English classes,Our job offer Full Stack Python/React Developer sounds interesting? Then we are looking forward to receiving your application!"
Senior Python Developer,Stylus,,"Категорія: Python,Англійська: Upper-Intermediate,5 років досвіду","Вакансія опублікована 28 лютого 2023,39 переглядів,1 відгук","Хто ми? — ми Stylus.ua,Чим ми займаємося? — ми інтернет магазин з найширшим асортиментом товарів. Також ми маємо offline магазини, точки видачі та сервісні центри у багатьох куточках України.,Кого ми шукаємо? — в зв’язку з новим проектом ми шукаємо Senior Python Developer,Чому саме ми? — тому що ми гарантуємо:,СТАБІЛЬНІСТЬ ТА НАДІЙНІСТЬ. Оплачувані відпустки та лікарняні.,НОРМОВАНИЙ ГРАФІК. з 9 до 18 (Сб та НД вихідні).,ЗРУЧНЕ МІСЦЕ РОБОТИ. м. Палац Україна (в двох хвилинах від метро) Можливо віддалено.,КОМФОРТНИЙ ОФІС. Завжди зі світлом та теплим чаєм або кавою.,СТАБІЛЬНУ ТА ГІДНУ ОПЛАТУ ПРАЦІ. За результатами співбесіди,Від кандидата ми очікуємо:,- Практичний досвід в проєктуванні, розробці, рефакторинг та відладці коду,- Досвід з оптимізацією, та написанням Unit testing.,- Розуміння підходу Object Oriented Design (OOD) в Python.,- Практичний досвід з Services/Micro-services архітектурами,- Знання дата форматів (JSON, JSONP) та використання їх у Python,- Досвід розробки масштабних Python проєктів з нуля або досв підтримки та розвитку такого проєкту протягом декількох років.,- Практичний досвід з Django.,Буде плюсом:,- Мультипроцесінг,- GraphQL,- Використання пакетів Python, таких як: pytest, pymongo чи інші DB packages (як SQLAlchemy), zookeeper (kazoo), Kafka,Що потрібно робити :,- Розробка e-commerce платформи високої доступності та готової до швидкого маштабування.,- Інтеграція зі стороніми сервісами, проєктування безпечної та стабільної інтеграції.,- Постійне покращення кодової бази, зниження рівня технічного боргу та розвиток проєкту.,- Робота з командою: код ревью колег, робота над style guide, code conventions та іншим.,Якщо це все про тебе, тоді ми чекаємо на тебе!"
Middle Django developer,PLANEKS,,"Категорія: Python,Англійська: Intermediate,2 роки досвіду","Вакансія опублікована 28 лютого 2023,101 перегляд,14 відгуків","0. Fast and comfortable hiring process.,1. 100% remote(even before the COVID) work opportunity and flexitime - choose working hours between 8:00-20:00.,2. Manage your compensation $$$$ budget - Travel tickets, Work equipment, Health insurance, Software, Sport, Training.,3. Salary paid in USD + tax compensation. Revision every 6 months. We want everyone to be confident in what tomorrow brings.,4. Everything to provide a good rest. YES: Paid vacation, national holidays, sick leaves(and support in case of serious diseases). NO: overtime, work on weekends.,5. Regular feedback, mentorship, code review. Friendly and professional team that supports you. Well, we're proud of how we handle that. So you can always count on us.,6. Speaking clubs with a native speaker to constantly maintain your English level.,7. No bureaucracy - transparent processes and flat management. Working remotely means keeping things as simple as possible to work efficiently.,We propose something more significant than a job. PLANEKS means developing a new lifestyle for our colleagues and clients. So take your part in it!,1. Software development experience(at least 2 years) with:,— Python and Django,— Other Python frameworks (e.g., Flask),— PostgreSQL, MySQL and MongoDB,— Celery, Redis, ElasticSearch,— Cloud providers, DevOps, CI/CD,— Unit, integration, E2E tests,2. Knowledge of REST and experience working with REST APIs,3. Experience with JS, HTML, CSS (Usually 0-20% of activity),4. Communication skills in English (good writing and speaking),1. Develop, support, and maintain projects in Python - usually, we create products from scratch but also have existing projects where the dev team should be extended. And also, we do not work with legacy codebases.,2. Solve technical challenges - all our projects are different, and you’ll never be bored with the same tasks every day, so your acquisitive mind will have great challenges regularly.,3. Take care of quality (code, test, business features, documentation) - everyone enjoys working with clean, readable code, so it is important to keep it such.,4. Participate in code reviews - usually, it is cross-reviews in the team or reviews by a senior person.,5. Communicate with internal and external teams - we’re in touch with great minds - inventive clients, and supportive colleagues!,6. Improve your technical and soft skills - just a normal evolution :)"
Senior Python Developer,Software Rocket,$4000-5500,"Категорія: Python,Англійська: Upper-Intermediate,3 роки досвіду","Вакансія опублікована 28 лютого 2023,84 перегляди,12 відгуків","At Software Rocket we are committed to what really matters - the exceptional service and high quality of our products, providing our employees with everything they need to achieve great results, avoiding the waste of their personal time on intrusive communication and annoying corporate culture.,If all of this resonates with you, we can't wait to see you become a part of our team!,- 4+ years of experience with Python;,- Experience with Flask (or Sanik), SQLAlchemy, Pandas, PyTest, SQL (MySQL, Aurora),- Nice to have working experience with Vue.js, TailwindCSS, ElementUI, Nuxt, Docker, Git & Github, Github Actions, AWS S3, RDS, Cloudfront, Terraform,- Ability to debug;,- Desire to learn more and improve oneself;,- Outstanding communication skills with team members, senior staff members, and clients;,- Self-manageable and proactive person;,- English — speaking level no less than Upper-intermediate;,- Engage in all phases of the software lifecycle- design, implement, test, deploy, and support services in production using Python,- Maintain a culture of code quality through rigorous testing, automation, and code reviews.,- Build and design performant APIs that can power and delight the user experience,- Stay up-to-date and aware of the latest web technology trends,- completely remote work;,- a responsible team of senior level specialists driven by the delivering of quality results;,- many projects, which allows you to switch in between in the future to improve your skills;,- paid vacation - 20 working days;,- 10 days of sick leave (with a medical certificate)."
Senior Fullstack Engineer,MWDN,,"Категорія: Python,Англійська: Upper-Intermediate,5 років досвіду","Вакансія опублікована 28 лютого 2023,20 переглядів,1 відгук","MWDN company is looking for a self-motivated and goal-oriented Senior Fullstack Engineer who would like to be a part of a team working on brand-new startup projects for foreign customers.,We Offer:,-People-oriented management without bureaucracy.,-The friendly climate inside the company is confirmed by the frequent comeback of previous employees.,-Flexible working schedule.,-Paid time off (18 working days per year, plus all national holidays and 9 sick days).,-Full financial and legal support for private entrepreneurs.,-Free English classes with native speakers or with Ukrainian teachers (for your choice).,-Dedicated HR.,-Comfortable offices in the city center (pets friendly btw:) ),-Possibility to choose your workspace either remotely or a combination of your home and one of our development offices.,Responsibilities:,-Design, develop and test new features: following product requirements, security guidelines, and monitoring.,-Support and maintain, and take part in the team’s On-call routines.,-Mentoring and guiding team members.,-Explore and establish new infrastructure.,-Explore and design complex solutions including 3rd party integration.,-Collaborating with product and development team members to deliver impactful product features.,Requirements:,-5+ years of experience with developing enterprise-grade backend microservices and cloud-based infrastructure.,-2+ years of Web frontend development using HTML, CSS, JS (Vue adv).,-Cloud platform knowledge, operation, and maintenance (GCP adv).,-Great knowledge of Python (2.x, 3.x) and NodeJS (Typescript adv).,-Extensive knowledge and experience in different data stores (RDBMS, NoSQL, KeyStore, etc).,-Experience with Serverless and Kubernetes (adv).,-Great communication skills and fluent English.,-Energetic Team player.,-Highly motivated, self-driven, and independent.,About the project:,This is a company that has recently become a part of a wide portfolio of a multinational software development group. Now it is looking for new tech talents able to reinforce their position in the market of customized digital signatures. Apply for a job and join a company that cares about people, their strengths, and their ambitions."
Senior Backend Developer,RemotelyTalents,$3500-5500,"Категорія: Python,Англійська: Upper-Intermediate,5 років досвіду","Вакансія опублікована 28 лютого 2023,38 переглядів,5 відгуків","Only for candidates from Ukraine!,Our client is a leading cybersecurity company in the software supply chain space. It maintains the industry-leading database of Python vulnerabilities. The Safety scanner is the most popular Python vulnerability scanner, with 1 million downloads every month by Python teams around the world.,Thousands of software development teams use our software and vulnerability data to keep their software projects secure, including Amazon, Apple, Intel, Dell, Redhat, Mozilla and many more!,They have completely distributed team with team members in North America, South America and Europe.,As a Senior Backend Developer, you’ll be joining a fast-growing engineering team to deliver our industry-leading security products to thousands of customers around the world!,Qualifications and Experience:,5+ years of experience as a developer,3+ years of experience as a Python software developer with exposure to a broad range of Python projects,Comfortable with git and GitHub for collaboration with other developers,Proficient in working with Django framework, including creating/updating models and working with routes and middleware,Familiarity with relational databases and constructing efficient SQL queries,Optional experience building/maintaining command-line utilities and tools,Confident English speaker with good written communication skills,Professional with a strong sense of follow-up and follow-through,Committed to continual learning and self-education,Excellent communicator for collaborating with team members globally over various mediums (Slack, Shared Documents, Video calls),Responsibilities:,Responsible for entire lifecycle of new features, including defining project specs, building back-end and front-end, testing, deploying, and performing maintenance,Respond to occasional bug reports,Break down big projects into actionable software development steps,Responsive and clear communicator, available during overlap hours with team and leaving clear messages/documentation when not online,Available during some business hours in Pacific time zone for team and customer meetings,We offer:,competitive salary paid in USD,B2B contract with paid vacation,fully remote work with flexible hours to fit your lifestyle,Our online recruitment process is simple and efficient:,Introduction interview with the recruiter,Interview with client, technical interview,Tech task,If you meet our requirements, we'll extend a job offer to you.,Don't miss out on this amazing opportunity to work with a leading cybersecurity company in the software supply chain space!"
